{
    "protocolVersion": 2,
    "kind": "handshake",
    "id": "handshake-1",
    "token": "3f8a1c0d5e2b47968a1d0c3f5e2b4796d8a1c0f35e2b4796a8d1c0f3e5b24769",
    "acceptedVersions": [2],
    "client": {
        "name": "gofer-godot-addon",
        "addonVersion": "2.0.0",
        "engineVersion": "4.7.1.stable",
        "projectPath": "/home/gofer/worktrees/task-17",
        "capabilities": ["session", "scene", "node", "project", "editor", "resource", "logs"]
    }
}
